title;total-time;serving-size;ingr;instructions;difficulty
Jamaican Fried Dumplings;20;6 servings;4 cups all-purpose flour, 2 teaspoons baking powder, 1 ½ teaspoons salt, ½ cup butter, ½ cup cold water, 1 cup vegetable oil for frying;In a large bowl, stir together the flour, baking powder and salt. Rub in the butter until it is in pieces no larger than peas. Mix in water 1 tablespoon at a time just until the mixture is wet enough to form into a ball. The dough should be a firm consistency. Knead briefly. Heat the oil in a large heavy skillet over medium heat until hot. Break off pieces of the dough and shape into a patty - kind of like a flat biscuit. Place just enough of the dumplings in the pan so they are not crowded. Fry on each side until golden brown, about 3 minutes per side. Remove from the pan and drain on paper towels before serving.;easy
Cuban Ropa Vieja;255;6 servings;1 tablespoon vegetable oil, 2 pounds beef flank steak, 1 cup beef broth, 1 (8 ounce) can tomato sauce, 1 small onion sliced, 1 green bell pepper seeded and sliced into strips, 2 cloves garlic chopped, 1 (6 ounce) can tomato paste, 1 teaspoon ground cumin, 1 teaspoon chopped fresh cilantro, 1 tablespoon olive oil, 1 tablespoon white vinegar;Heat vegetable oil in a large skillet over medium-high heat. Brown the flank steak on each side, about 4 minutes per side. Transfer beef to a slow cooker. Pour in the beef broth and tomato sauce, then add the onion, bell pepper, garlic, tomato paste, cumin, cilantro, olive oil and vinegar. Stir until well blended. Cover, and cook on High for 4 hours, or on Low for up to 10 hours. When ready to serve, shred meat and serve with tortillas or rice.;hard
Conch Fritters;35;8 servings;1 quart oil for frying, ¾ cup all-purpose flour, 1 egg, ½ cup milk, ground cayenne pepper to taste, seasoned salt to taste, salt and pepper to taste, 1 cup chopped conch meat, ½ onion chopped, ½ green bell pepper chopped, 2 stalks celery chopped, 2 cloves garlic chopped, 2 tablespoons ketchup, 2 tablespoons lime juice, 1 tablespoon mayonnaise, 1 tablespoon hot sauce;Heat the oil in a large pot or deep fryer to 365 degrees F (185 degrees C). In a bowl, mix the flour, egg, and milk. Season with cayenne pepper, seasoned salt, salt, and pepper. Mix in the conch meat, onion, bell pepper, celery, and garlic. Drop the batter by rounded tablespoons into the hot oil, and fry until golden brown. Drain on paper towels. In a bowl, mix the ketchup, lime juice, mayonnaise, hot sauce, salt, and pepper. Serve dipping sauce on the side with the fritters.;medium
Easy Mojitos;5;1 cocktail;12 leaves mint, 2 lime slices, 1 teaspoon white sugar or more to taste, ¼ cup ice cubes or as needed, 1 (1.5 fluid ounce) jigger rum (such as Bacardi®), 4 ½ ounces diet lemon-lime soda (such as Diet Sprite®);Place mint leaves, lime slice, and sugar in bottom of a glass and muddle with a spoon until mint is crushed. Fill glass with ice cubes. Pour rum and soda over the ice stir.;easy
Mojo Grilling Marinade;15;3 cups;6 cloves garlic coarsely chopped, ½ cup minced yellow onion, 1 cup freshly squeezed orange juice, ½ cup freshly squeezed lime juice, ½ teaspoon ground cumin, 1 teaspoon dried oregano flakes, ½ teaspoon lemon-pepper seasoning, ½ teaspoon freshly ground black pepper, 1 teaspoon kosher salt, ¼ cup chopped cilantro, 1 teaspoon hot pepper sauce (e.g. Tabasco™), 1 cup olive oil;Pulse the garlic and onion in a blender until very finely chopped.  Pour in orange juice, lime juice season with cumin, oregano, lemon-pepper, black pepper, salt, cilantro, and hot pepper sauce.  Blend until thoroughly incorporated.  Pour in the olive oil, and blend until smooth.;easy
